tid,date_created,text,favorite_count,retweet_count
772898779188097024,2016-09-05 16:46:43,"A propósito de la escasez , #Mitos y realidades de las fechas de vencimiento de medicinas http:// flip.it/-JsSV5 pic.twitter.com/ewBBPj0pLk",0,0
761114522589376512,2016-08-04 04:20:17,""" @Twittores : Así como vamos en el año 2050 habrá escasez de alimentos en el mundo #World http://www. grandesmedios.com/asi-ano-2050-h abra-escasez-alimentos-mundo/ … "". O sea, Vzla se adelantó",0,0
752458627542286336,2016-07-11 07:04:51,"Buen día revocar al gobierno es revocar a la dictadura, revocar a la escasez , revocar la corrupción y a la delincuencia, es devolver la paz",0,0
749785124695408641,2016-07-03 22:01:18,""" @josetorohardy : Según la Ministró de Salud la escasez de medicinas es de sólo el 15%. Entre ellas están todas las que yo he necesitado""",0,0
745449839719223296,2016-06-21 22:54:26,La escasez es tan fuente en Venezuela que los gobernantes carecen de cerebro de neuronas @fdelrincon #conclucrisis,0,1
744223195729903616,2016-06-18 13:40:11,@AsambleaVE grave situación atraviesa la industria gráfica y esto repercute en la escasez !,0,0
741462022022369280,2016-06-10 22:48:16,"No es solamente la escasez que cada dia se agudiza mas, se le suma lo costoso de los productos miles de miles de bs. Que no se ganan.",0,0
731534745625088000,2016-05-14 13:20:49,"@sumariumcom Lo dice quien baila salsa en cadena nacional mientras su país es asediado por el hampa, la pobreza y la escasez .",0,0
728739961827119104,2016-05-06 20:15:20,“ @NoticiasVenezue : ¡AGOBIADA POR LA BRUTAL ESCASEZ ! Se suicida por no encontrar comida para sus hijos http:// goo.gl/CFn0o4 ”La Haya..,0,0
728247951357845504,2016-05-05 11:40:16,Maduro crea más burocracia para resolver escasez de equipos quirúrgicos y fármacos: http:// bit.ly/1VJo7lp . pic.twitter.com/j3SMqW0dOG,0,0
720667672086716417,2016-04-14 13:38:57,La escasez de alimentos es culpa de Rodolfo Marco Torres y Felix Osorio http:// buff.ly/1SDI0n4,0,0
720416518958358528,2016-04-13 21:00:57,"No vamos a permitir que nuestro pueblo siga pasando hambre, inseguridad, escasez , la paz y progreso que ellos merecen es nuestra prioridad",0,0
718551188921327616,2016-04-08 17:28:48,""" @ejrl : Aristóbulo afirma categórico y sin una señal de sarcasmo: la inseguridad y escasez son inducidas"" él y sus fumaradas de lumpias!!!",0,0
718172808929525761,2016-04-07 16:25:15,"Sr Maduro escucharlo es algo aberrante,sus niñadas y falsos vocablos dan una inapetencia constante.Hable de la salud, escasez ,inseguridad.",0,0
718158128798429184,2016-04-07 15:26:55,#AmnesiaCriminalNoVa hoy 3 horas de cola en central para comprar un paquete de pañal. Lo q tienen q resolver es la escasez corruptos,0,0
707303503073513472,2016-03-08 15:34:30,"@la_iguanatv Lo que sin duda ha subido es la escasez , la inflación, la angustia y la desesperanza.",0,0
706078848740413440,2016-03-05 06:28:10,""" @botellazo : El chavismo nos hizo vivir escasez en época de vacas gordas. Ahora, en la de vacas flacas nos hace vivir tiempos de miseria""",0,0
705590787187326976,2016-03-03 22:08:47,Polar a un paso de cierre tecnico.Sin divisas no hay produccion. Son producción hay desempleo y más escasez son los únicos que nos alimentan,0,0
702263650896257025,2016-02-23 17:47:56,Reportan escasez de gasolina de 91 octanos en Carabobo http:// dlvr.it/KbNNfk pic.twitter.com/uBsWMQf9fs,0,2
701247384022605824,2016-02-20 22:29:39,@2001OnLine Grito de Libertad inseguridad abuso de poder escasez medicina comida .Mejor dicho de todo.Hambruna.SOS.,0,0
697594622906920960,2016-02-10 20:34:53,"Doloroso ver a nuestros niños disfrazados de "" escasez "" o pasando sus carnavales haciendo colas en supermercados. Sera "" escasez querida""?",0,0
696008676465889280,2016-02-06 11:32:54,Municipio #Guaicaipuro mega cola en el super líder los Teques en la Panamericana. #Escasez … https://www. instagram.com/p/BBc59SGyMxv/,1,11
691720296131354626,2016-01-25 15:32:24,"Carneiro: ""Aquí no hay escasez , aquí hay amor y patria"" http:// bitly.com/1OT7MTg pic.twitter.com/0If7OZexcb será en tu casa ladrón d mierda",1,0
688124691207196679,2016-01-15 17:24:45,"Esto es más memoria y cuentos, hasta cuando habla de la corrupción, inseguridad, escasez , habla de la gravedad en sistema de salud....",0,0
687022798162817024,2016-01-12 16:26:14,"@numamolina Muy triste! Pero vuelva sus ojos hacia Vzla: Escasez , desabastecimiento, sin medicinas, inseguridad, inflación.......",0,0
685961462431526912,2016-01-09 18:08:51,"Inflación, escasez , inseguridad y grosera corrupción, todos juntos a millón y además fuera del control del gobierno #PeroTenemosCuadros",0,1
685900970455363584,2016-01-09 14:08:29,https:// twitter.com/owszmpn/status /685890434275606528 … la escasez y la inseguridad,0,0
684484493072273408,2016-01-05 16:19:54,@JulioBorges ES PRIORIDAD ATACAR LAS COLAS Y LA ESCASEZ TAMBIÉN CONTROLAR LA INSEGURIDAD Y LA INFLACIÓN ESO NO SE MENCIONÓ EN LA AGENDA!,1,0
681138434317127680,2015-12-27 10:43:52,Hay gran escasez de pastillas anticonceptivas ¿Será por eso que ahora noto más niños pequeños llorando en el metro? #FelizDomingo #Venezuela,2,0
675706291222917120,2015-12-12 10:58:28,"Digo hablen sin miedo y exijan las responsabilidades, en cuanto a la inflación, a las colas, a la escasez , a la inseguridad, quienes son",0,0
673700108521852928,2015-12-06 22:06:37,Y que creian que con una inflación avasallante; escasez de alimentos y agua; nepotismo; clientelismo; corrupción galopante; Etc. Etc. Etc.,0,0
673693955473711104,2015-12-06 21:42:10,"La aplicación del modelo marxista (expropiaciones, escasez , inflación, inseguridad) fue la razón básica para que el PSUV dejase ser mayoría",0,0
670092430998429696,2015-11-26 23:10:59,"@jogre8a Dios mío! Destruyeron al país: inflación q nunca vivimos, más pobreza, inseguridad desatada, escasez , cero producción! Despierten!",0,0
669902691615797248,2015-11-26 10:37:02,"Demasiado imbécil querer votar por un gobierno que te tiene haciendo colas, te tiene en escasez , e inflación.. jalabolas. #LaManitoNiDeVaina",0,0
669166853265182720,2015-11-24 09:53:04,"Haces colas, hay escasez , hay delincuencia, te gobiernan narcos, hay inflación, y tu dices.. #YoDefiendoMiRevolucion y yo digo jalabolas :v",0,0
667029052771966977,2015-11-18 12:18:13,"Faltan 18 días para empezar el cambio ya basta d tantas colas, tanta escasez , el gobierno nos tiene en la miseria pic.twitter.com/Sl28toeq9m",0,1
666808936889196545,2015-11-17 21:43:33,"Venezuela con este gobierno esta en la miseria, la delincuencia desatada, escasez , inflación, nos gobiernan son narcos #SOSTerrorismoEnVzla",2,9
666418951006633984,2015-11-16 19:53:54,"Ellos son escasez , delincuencia, inflación, ladrones, en fin.. #PSUVNarcoTerroristas",0,2
664785002916397056,2015-11-12 07:41:10,Según Maduro 30 huevos cuestan BSF 420 y 1 Kg de carne 500.. así como en la Isla de la Fantasía las vacas vuelan. Lo q viene es más escasez !,0,0
658820238272663552,2015-10-26 21:39:19,Mientras #MaduroFirmaXLaPaz los venezolanos vivimos en guerra contra la escasez la inflación y la inseguridad! Este 6D Vota por el cambio,0,0
657509622232805377,2015-10-23 06:51:24,"@unaiamenabar este gobierno es un chiste, quieren controlar todo y no pueden, desempleo, mas escasez , y cierre técnico es lo que viene.",0,0
657300941260107777,2015-10-22 17:02:11,"#ChavismoEsVictoriaAbsoluta en lo que se refiere, delincuencia, escasez , inflación, expropiar, etc en eso tienen razón nadie les gana",0,1
656678462237880320,2015-10-20 23:48:40,@RunRunesWeb @runrunes Ay ay ay! Ahora si se subió la gata a la batea! Más corrupción y escasez !,0,0
642177306291740672,2015-09-10 23:26:15,"Y aun así hay gente que dice que estamos bien, que no hay escasez , inseguridad, dejen la ignorancia y habrán los ojos.",0,0
639971414204907520,2015-09-04 21:20:49,"@Notidiahora Al menos q deporten a todos los VENEZOLANOS Y EXTRANJEROS, el Pais sin habitante y se acaba la ESCASEZ , problema resuelto",0,0
637458189181657089,2015-08-28 22:54:10,No hayan como tapar nuestra realidad INSEGURIDAD escasez y las interminables colas que falta de valores tiene esta gente,1,0
633152931475398656,2015-08-17 01:46:36,"Escasez incrementa la depresión y la ansiedad entre venezolanos, me incluyo en ese grupo. http:// bitly.com/1IVljH0",0,0
627657711480623104,2015-08-01 21:50:34,Comenzo el colapso y la etapa final de esta pesadilla. Hay hambre en el pueblo y miles de personas mueren por la escasez de medicamentos.,0,0
620759974810136581,2015-07-13 21:01:25,UNT propone plan de emergencia al gobierno para enfrentar escasez de alimentos y medicinas http:// bitly.com/1Lczyv4 via @ElNacionalWeb,0,0
620382178522845184,2015-07-12 20:00:12,""" @lord_inario : También hay escasez de libros, y no veo a la gente haciendo compras de pánico.""Son sumamente caros y estamos quebrados ...",0,1
617761982305968128,2015-07-05 14:28:28,"En revolucion ellos con escolta y camionetotas y el pueblo sufre las penurias d la escasez , el difunto vive y el hambre sigue asi pues!!!",0,0
616562446090768384,2015-07-02 07:01:56,"@primerapagina otro pote de humo lo de las grabaciones, y estamos ya! En el segundo semestre y continuamos en caos de escasez y no se ve",0,0
616561849031610368,2015-07-02 06:59:34,"@primerapagina comenzamos el 2do semestre del año y no se ha resuelto la escasez y es que todo en este país se volvió un rebusque, trite",0,0
616093439663439876,2015-06-30 23:58:17,@unidadvenezuela : En 2013 comenzó el problema de escasez de productos en Venezuela. Hoy la situación es peor. (Video) http:// bit.ly/1JuJPUi,0,0
615248624310730752,2015-06-28 16:01:17,"@ROBERTOOSPINO1 Está bien si les gusta la inseguridad, la escasez y la inflación sigan con su revolución",0,0
613553499884924928,2015-06-23 23:45:28,""" @NTN24ve : La ONU preocupada por la grave escasez en Venezuela http:// bit.ly/1CruwDR pic.twitter.com/EdyNLuh7eq ""y x no se preocupa por HAITI¿",0,0
611630547534807040,2015-06-18 16:24:20,@VVperiodistas en vez d ir a protestar los la escasez o por la inseguridad de país q el hampa nos esta matando a tod@s ..,0,0
610992469682094080,2015-06-16 22:08:51,"@ElNacionalWeb Por supuesto,ya no habrá nada que comprar ( doy fe que yo no consigo nada de regulados).La escasez prevalece.",0,0
610444559789780995,2015-06-15 09:51:39,#14J Madres y Padres llegaron a la Gobernación en protesta contra la escasez de fórmulas lácteas para bebés http:// t.co …,0,0
610152325873827840,2015-06-14 14:30:25,"«Todo país tiene el Gobierno q se merece» Mientras Vzla.cae a pedazos x escasez , delincuencia y megainflacion, estamos pendiente del fútbol",0,0
607201839092756481,2015-06-06 11:06:14,@VTVcanal8 como se ve q la FAO no esta en venezuela y no ven la escasez ni las colas. Ya ni papel tuale se consigue pero tenemos PATRIA,0,0
604012513701842944,2015-05-28 15:52:59,""" @superconfirmado : Escasez de insulina ponen en riesgo vida de diabéticos http:// sconfir.com/1Hyeud5 pic.twitter.com/l5vuFUpRIA "" @marisolcordido",0,2
602167346271223810,2015-05-23 13:40:57,@nve24com Es tan obvio el querer culpar a otros de la escasez que Per se cae en la ridiculez,0,0
601475209036697602,2015-05-21 15:50:39,""" @actual360 :Sector lácteo se queda sin empaques Via http:// actualidad360.com/?n=20326 ""Si ya era difícil ahora será peor la escasez y con ello la crisis",0,0
600059353765257216,2015-05-17 18:04:33,"@EspejoPublico @AlbertoRavell : ONU exige explicaciones a Venezuela sobre la escasez , mientras FAO premia a Maduro http:// patil.la/1ETrEAK",0,0
599196150277808129,2015-05-15 08:54:29,"RT @MinSalud_Vzla: el #SIAMED desarrolla un sistema de información que da respuesta a la escasez de medicamentos... pic.twitter.com/qSAFe8uo8a """,0,0
599141995064459265,2015-05-15 05:19:17,@VTVcanal8 estos medios del gobiernucho no muestran las colas los asesinatos la escasez la corrupción del gobiernucho.,0,0
598881268714119169,2015-05-14 12:03:15,"Cada día las colas son mayores, la escasez y la inseguridad sin limites. Los centros de salud sin… https:// instagram.com/p/2qxiMuCakB/",0,0
596143693712760832,2015-05-06 22:45:07,""" @ElNacionalWeb : Escasez de insumos odontológicos impacta en costos de consultas http:// bitly.com/1dNCMbB (Vía @elpropioweb )"" @AndreinaLara86",0,1
592423528198184962,2015-04-26 16:22:30,“ @la_patilla : Juan Barreto confiesa que casi muere por la escasez de medicamentos (Video) http:// patil.la/1Fmz3fS ” Lastima que lo encontró,0,1
592124852678598656,2015-04-25 20:35:40,""" @NTN24ve : Dirigente chavista asegura que casi muere por escasez de medicamentos http:// goo.gl/FmI5qW """,0,0
591992980103364608,2015-04-25 11:51:39,Todos los venezolanos sabemos cual es s la solución #desgobierno #escasez #ineficiencia #malagerencia … https:// instagram.com/p/151Gl7iar5/,0,0
591583033322508288,2015-04-24 08:42:40,Y es que la solución a la crisis de Vnzla es no dar $ a @fedecamaras ? Al revés! Eso criminaliza a la empresa privada y traerá mas escasez .,1,1
591568645282734080,2015-04-24 07:45:30,No dudo existan laboratorios que hagan mal uso de los $ preferenciales para medicamentos pero si es seguro que esa no es la causa de escasez,0,0
591549903605788672,2015-04-24 06:31:02,Esperan que se profundice la escasez si se aplican más recortes de dólares http:// tinyurl.com/nqd5x92 vía @ELUniversal,1,0
590446863800733696,2015-04-21 05:27:56,"@unaiamenabar Los Vzlnos pertenecemos a la cultura de sobrevivencia; escasez de alimentos, medicinas, insumos, inseguridad y caos social!",0,4
590346747383263232,2015-04-20 22:50:07,""" @ElUniversal : Invepal asegura que resolverá problema de #escasez de todo tipo de papel #Venezuela http:// ow.ly/LSBWn "" Jajaja",0,0
590107853349920768,2015-04-20 07:00:50,""" @la_patilla : Rubén José Contreras López: ¿Nuestro problema? La escasez pero de valores… http:// patil.la/1DCOduT """,0,0
589447843716431872,2015-04-18 11:18:12,@JacquelinePSUV @VTVcanal8 en 2 años hemos logrado mas asesinatos q nunca + escasez q nongun PAIS pic.twitter.com/BnOOktSkJj,0,0
589438399133700096,2015-04-18 10:40:40,@MonicaOdm @ETrippi2 @napoleonbravo aquí se vende la escasez por Kg,0,0
589261430957957120,2015-04-17 22:57:27,@NancyPerezPSUV Sin preservativos y anticonceptivos que pasará con cifras de embarazo precoz y ETS? Escasez de lentes contacto para no ver?,0,0
588463549913128960,2015-04-15 18:06:58,"@analitica Vida de la mujer en revolución? Colas, escasez , inflación, miedo a perder los hijos por la delincuencia...",0,0
588142568560525317,2015-04-14 20:51:30,"¿Radicalizar el hambre, la escasez , violencia "" @vertvnoticias : ¡Se irán a quedar solos! Maduro anuncia que radicalizará la revolución",0,0
587939887296471040,2015-04-14 07:26:07,"A punto de tocar fondo RT"" @ferinconccs : Dólar por las nubes, sigue monumental escasez , despilfarro y robadera #Venezuela en bancarrota""",0,0
586967227368345600,2015-04-11 15:01:06,"@CumbrePanama si en especial la de Vzla tenemos más muertes q en cualquier guerra, miseria y escasez",0,0
586963397285130240,2015-04-11 14:45:53,"No escuche a Maduro hablar de Derechos Humanos, De la Violencia que Vivimos, de la escasez que padecemos #MaduroTuAMiNoMeRepresentas",1,7
586952951341654016,2015-04-11 14:04:23,Para saber que pasa en Venezuela venga a hacer mercado y escuche al pueblo q se mueve entre la inflación y la escasez . #CumbreDeLasAmericas,0,0
586951787829133312,2015-04-11 13:59:45,"@CumbrePanama @NicolasMaduro aquí todos estamos disfrutando d las riquezas d ru revolución. Desempleo, escasez y delincuencia",0,0
586950727744016384,2015-04-11 13:55:33,"La revolución de hambre, de colas, delincuencia, escasez , pobreza y sin ley",0,0
586932711652196355,2015-04-11 12:43:57,"@jose_m4a1 @willycochez @GenPenaloza miseria, escasez , devaluación, entanflacion y pelazon",0,0
586718307992100864,2015-04-10 22:31:59,""" @periodicovzlano : ¡Va por el 70%! Escasez de medicina en #Venezuela http:// tinyurl.com/otbmx6z """,0,0
586634889258209280,2015-04-10 17:00:31,No puede ser que esta Sra representante de los afectados por Guarimba .no sabe si hay escasez en nuestro Pais.Donde vive ella?,0,0
586631853060263937,2015-04-10 16:48:27,#cumbreCNN Esta señora Yendry Velazquez vive en Disney!? No está parcializada?! No hay escasez en vzla!?,0,0
586580064592093184,2015-04-10 13:22:40,"Reducción de divisas y escasez de cupos aéreos castigan a venezolanos. Solo viajaran los corruptos con sus ""ahorros"" en Andorra",0,2
586213838858629120,2015-04-09 13:07:25,@VTVcanal8 si eso es correcto hay q pensar en el hambre las colas la escasez la inseguridad las medicinas ese es el Nvo pensamiento,0,0
585934426523226113,2015-04-08 18:37:08,"#PreguntasRevolucionarias ¿Porque hay escasez de Gas domestico,cemento y cabillas,si son mercados exclusivos del Gobierno?",1,2
585853496961986560,2015-04-08 13:15:32,Paralizada producción nacional automotriz por escasez de divisas http://www. ntn24web.com/node/46148,0,0
585608337280073728,2015-04-07 21:01:22,Balance compras 1er trimestre: 0 harina pan 0 cafe 0 papel toilet 0 panales abuela 4 kilos jabon en polvo #escasez,0,0
585449448936988672,2015-04-07 10:30:00,"Yo no había comido antes como ahora. Antes comía, ahora con tanta escasez y colas...nada de nada.",0,0
585410998611398657,2015-04-07 07:57:13,"""Ocho supermercados privados exigen terminal de cédula"". Y ni así se acaban las colas ni la escasez .",0,0
585279395859984384,2015-04-06 23:14:16,"Alejandro Fleming: ""La culpa de la escasez es de los venezolanos por consumo..q tal? excesivo"". pic.twitter.com/7nCn7wANzB",0,0
585054846237220864,2015-04-06 08:21:59,La corrupción la inseguridad la escasez predominaron en la quema de Judas en Vzla,0,0
584877551945912320,2015-04-05 20:37:29,"¿25 meses de qué? Escasez , colas, revendedores, aumento de la inflación...",0,0
584410486961209344,2015-04-04 13:41:32,Todos en trapo rojo de firmas y peleas de oposición. La escasez es tremenda. Carne#nohay entre otros cosas,0,0
584365149944946688,2015-04-04 10:41:23,Harta de la ineficiencia y escasez .,0,0
584321464343605248,2015-04-04 07:47:47,"Tuvimos que pagar impuestos pero seguimos sin tener seguridad, hay escasez , hay pobreza. Hasta los + optimistas perdemos la paciencia",0,0
584011203657142273,2015-04-03 11:14:56,"@cedise En lo único que es eficiente el socialismo es en producir escasez , pobreza y miseria. Cuba es gran ejemplo de ello. Nosotros también",0,0
583541307538350080,2015-04-02 04:07:44,Estamos viviendo las escasez más exponencial en políticas públicas para erradicar la crisis económica. Falta AMOR A LA PATRIA !,0,0
583401205940019200,2015-04-01 18:51:01,@RMarcoTorres @NicolasMaduro por que mejor no luchan contra la delincuencia y la escasez con chavez no pasaba esto que pasa? No pueden solu,0,0
581260727970852864,2015-03-26 21:05:31,La escasez persiste en vzla.,0,0
580470745316376576,2015-03-24 16:46:24,@globovision gente sin oficio. Xq no hacen eso mismo en contra de la inseguridad la escasez la inflación el pesimo estado de hospitales,0,0
580414594797162496,2015-03-24 13:03:17,""" @ATodoMomento_ : El reportaje español que desnuda la cruda escasez en Venezuela (Videos) - http:// bit.ly/1ENPYpB pic.twitter.com/FddCxjSnRi """,0,0
580195273084923904,2015-03-23 22:31:47,"Por que sigue la escasez si @CencoexOficial otorgó más divisas para alimentos, medicamentos e higiene personal? http:// la-tabla.blogspot.com/2014/10/cencoe x-aumento-hasta-en-500-por-ciento.html … f",1,5
578883083442786305,2015-03-20 07:37:36,“ @FotosQChavezNoQ : (ATENCION) Esto Fue en la 4ta republica la Que odian tanto pic.twitter.com/NOJo4vF8dC @InformadorVeraz ” sin colas ni escasez,0,0
578297999031451648,2015-03-18 16:52:41,El pueblo está en las calles indignado por la escasez,0,0
577857361362161664,2015-03-17 11:41:45,A la falta de insumos y la escasez se suma la falta de bombillos no se consiguen en ningun lado viva la patria bonita @berenicegomez52,0,0
577578790202839040,2015-03-16 17:14:49,Me pregunto algo inocentemente: Ha servido a remediar la escasez la implantación del sistema biométrico???,0,2
575680165579210753,2015-03-11 11:30:21,@VTVcanal8 en vez de pronunciarse contra las colas la escasez y el alto costo de la vida a la q nos ha llevado esta robolucion,0,0
575623913331376128,2015-03-11 07:46:50,"Inseguridad, escasez ,inflación,colas,falta d medicinas e insumos,devaluación y Maduro con la Ley Habilitante ¿Solucionará eso? @primerapagina",1,0
575609901344550912,2015-03-11 06:51:09,"@NicolasMaduro no vamos a perder d vista q el problema nuestro no es que le quiten ls propiedades a tus 40 ladrones sino escasez , inseg, etc",0,0
575118166503866368,2015-03-09 22:17:10,@alejofjc no es juego !!! Pero para nada creo que USA tenga nada que ver con la escasez y la inseguridad!,0,0
575073502501474304,2015-03-09 19:19:42,"@ElNacionalWeb @elpropioweb y ante la escasez de divisas va a seguir subiendo eso no solo causa inflación, también paraliza el mercado int.",0,0
574058542027636737,2015-03-06 23:06:36,"No sólo escasez de alimentos predomina en VNZLA, también la escasez d ética del periodismo mostrada por Villegas. Q pena con @soyfdelrincon",0,0
573838040197652481,2015-03-06 08:30:24,Sin correctivos económicos se agravarán escasez e inflación http:// ow.ly/JZFTF,0,0
573816379708735489,2015-03-06 07:04:20,"HAITÍ, UN PAÍS POBRE y no hay escasez * VENEZUELA, UN PAÍS RICO (o era?) y no hay un coño. Explícate, revolucionario pic.twitter.com/uRNumq4rOn",0,0
573438524319531008,2015-03-05 06:02:52,En un país de escasez hoy amaneció Caracas con Fuegos artificiales para celebrar un año mas de muerto del destructor de país,0,2
573290272681021440,2015-03-04 20:13:46,"@la_patilla Será haber demostrado la fortuna q dejó Cháves un país EMBARGADO, ESCASEZ , CORRUPCIÓN, INSEGURIDAD, IMPUNIDAD DESEMPLEO y V/DDHH",0,0
573288693538025472,2015-03-04 20:07:30,Quien da los dólares para traer gatorade? No veo escasez de Gatorade que raro verdad ?,1,0
573195915386855424,2015-03-04 13:58:50,"Antes en la cuarta era tan chevere hacer mercado, ahora es un asco. Escasez , inflación y mucho pero mucho niche",0,0
572029369243308032,2015-03-01 08:43:24,En Vzla lo q existe es Escasez Devaluacion Muertes Inseguridad Presos Politicos Corrupcion Narcosoles Crisis Hospitalaria Almentos No Hay.,0,0
571794006012772352,2015-02-28 17:08:09,"Ahora pregunto:Con las sanciones de Vzla a funcionarios de USA, nos soluciona el problema de escasez y la mega inflación q nos esta matando?",0,0
571422399142498306,2015-02-27 16:31:31,"El único culpable de la escasez , inflación y mega devaluación es MADURO #MaduroAsumeTuBarranco",0,0
571309624823042048,2015-02-27 09:03:23,Hoy nada que celebrar. Este el país con la mayor tasa de inflación de escasez y de inseguridad gracias a la incapacidad de 16 años de gob.,0,0
570639862254211073,2015-02-25 12:41:59,"Que abuso, mientras la escasez nos consume, Maduro encadena para sembrar mas odio",0,0
570283978982367233,2015-02-24 13:07:50,"Abrir alguna de mis redes sociales y que sólo me encuentre con noticias de muertes, escasez y más muertes...",0,0
569626416674959361,2015-02-22 17:34:55,"@elheraldoco Con eso no se va acabar LA ESCASEZ , LA CORRUPCIÓN, LA DELINCUENCIA, LA HIPERINFLACIÓN, EL NARCOTRÁFICO Y LA VIOLACIÓN DDHH",0,0
569184509247287296,2015-02-21 12:18:56,"El peo para el gobierno es que ya en marzo se va a agudizar la escasez . Si, va a empeorar",0,0
568422094729576448,2015-02-19 09:49:22,""" @DolarToday : Arreaza: La escasez es culpa de la oposición -? https:// bit.ly/1z2fjGC pic.twitter.com/AA5KJtH9bX ""GENTE TORPE COMO ESTE JAMAS!!!",0,0
568155082702913536,2015-02-18 16:08:22,Hoy comienza la 2da parte de la novela del atentado y el golpe. Mientras el pueblo sigue sufriendo escasez e inseguridad. Basta Ya,0,0
567428433538744320,2015-02-16 16:00:55,"@ResistenciaV58 : Venezuela #16F Así celebramos el carnaval contra la escasez de productos básicos pic.twitter.com/tWpXkxzbWX ""."" @maitemartinez11",0,0
567340416438394881,2015-02-16 10:11:10,@felixfarias01 por qué no discuten con empresarios cuánto cuesta producir alimentos en el país y sincerar precios y evitar escasez ??,0,0
567301556052041728,2015-02-16 07:36:45,"Sobrevivir en pobreza y falta d oportunidades,sorteando escasez ,morir baja la mano del hampa,o del Regimen si protestas,o emigrar,q legado!!",0,0
567129723860684803,2015-02-15 20:13:57,"@la_patilla no señor a los diabeticos no, la escasez de alimentos, de medicinas, de repuestos y de empleos nos afecta a todos",0,0
566066133628125185,2015-02-12 21:47:37,"Tanta falta de principios en los gobernantes de este hermoso país, la escasez afecta a todos. Razona y VETE. pic.twitter.com/l1zlo1Ql3G",0,0
565732931885617152,2015-02-11 23:43:36,"@alexagomez2000 Eso es como aquello de que no hay escasez , sino falta de abastecimiento...",0,2
565479443813392385,2015-02-11 06:56:20,Persiste escasez de #medicamentos aunque se importan 4 veces más kilos que en 1998 http:// la-tabla.blogspot.com/2015/02/venezu ela-importa-cuatro-veces-mas.html … #PuebloContraLasMafiasB,0,7
565189962010992640,2015-02-10 11:46:02,Mantienen el subsidio a la comida porque es más facil culpar a la guerra económica por la escasez que asumir su desastre.,0,2
564937319321706497,2015-02-09 19:02:07,@RunRunesWeb @LibreDebat ...INDIGNOS ...Y EL PUEBLO PASANDO ESCASEZ Y CARESTÍA ...,0,0
564240105020596224,2015-02-07 20:51:38,@HectoRodriguez en Venezuela la gran escasez que hay es espiritual se han alejado de DIOS y sus principios. Y se han perdido valores,0,0
