tid,date_created,text,favorite_count,retweet_count
779407646285766656,2016-09-23 15:50:38,"La destrucción del aparato productivo, trajo cm consecuencia el hambre q pasamos. @maximo_sanchez . @JoseAGuerra pic.twitter.com/tDBwTpT3Tj",1,8
774409930141040640,2016-09-09 20:51:29,"Hambre en Venezuela: Cientos de personas obligadas a buscar comida entre la basura http:// bit.ly/2cqZpWv pic.twitter.com/XtzBqni8RZ """,0,6
774396597199376384,2016-09-09 19:58:31,Las mascotas venezolanas pasan hambre al profundizarse la crisis económica - http:// goo.gl/gCZgZ4 pic.twitter.com/oZl6G63Nki,1,15
770815914023522304,2016-08-30 22:50:09,##YoQuieroQVzlaVuelvaAlTiempo en que los niños y las mascotas no morían de hambre y falta de medicamentos #1SeptTodosALaCalle,15,34
762991779050323968,2016-08-09 08:39:50,"Los únicos motores q ha encendido este Gob han sido los el hambre ,miseria,violencia #VamosPorEl20 pic.twitter.com/lIaXCEIZkc "". @maximo_sanchez",1,7
762245909480673280,2016-08-07 07:16:01,"unidadvenezuela El hambre , el dolor de la gente, la rabia del pueblo no admite más dilaciones: Venezuela #MarchaACaracas este #1Sep """,5,7
760978824830001152,2016-08-03 19:21:04,"#Graficodelasemana Amor con Hambre , no dura #Economia #petroleo #Venezuela @Ecoanalítica https://www. instagram.com/p/BIqi-AzADkj/",2,6
759126314221699073,2016-07-29 16:39:51,"http://www. cesarmiguelrondon.com/opinión-2/el-e spacio-de-mis-amigos/ese-carajito-aqui-no-entra-leonardo-padrón/ … INSÓLITA REVOLUCIÓN: INSEGURIDAD, HAMBRE , MISERIA, ESCASEZ, REPRESIÓN, CORRUPCIÓN, INFLACIÓN, DICTADURA",1,6
754854242834325504,2016-07-17 21:44:10,@ladyllada @djaimesster Y esta señora a quien culpara por la muerte de miles de venezolanos por hambre y falta de medicinas,3,6
744244803043483648,2016-06-18 15:06:03,@lahijaderam @CASTORFAVELO es así... y la verdad q están. jodidos no decian con hambre y sin empleo con chavez me restreo... q se jodan!,2,12
744243654722723840,2016-06-18 15:01:29,las consecuencias de su brutalidad y maldad @CASTORFAVELO : (…) AHORA GRINTAN TENEMOS HAMBRE ! CHAVISTAS ROJO PICHON! pic.twitter.com/O1UR0f1vLy,2,12
743158525820542976,2016-06-15 15:09:34,El Gobernador de Sucre admite que no tiene capacidad para alimentar a la totalidad de los sucrenses. Revolución del hambre .,2,11
742911250909302784,2016-06-14 22:46:59,"Cumaná El saqueo verdadero se lo dieron a Venezuela. El PSUV saqueó a PDVSA el BCV y la moral de la FAN, eso si es saqueo lo demás es hambre",1,6
741969247535017984,2016-06-12 08:23:48,"Infografia sobre los saqueos, conocidos en la prensa como ""mini estallidos sociales"" o ""protestas por hambre "" pic.twitter.com/V759u39g5s",28,117
740618019307687937,2016-06-08 14:54:30,Esta es la respuesta que te da el genocoda de @NicolasMaduro a un pueblo con hambre este el dialogo que quier el gob pic.twitter.com/p3SsHvnS4c,2,14
740271538411278336,2016-06-07 15:57:42,En Carora el pueblo también tiene HAMBRE . La gente pide comida al Gobierno de Maduro. pic.twitter.com/sCgj1yLN0B,4,8
739874728509313024,2016-06-06 13:40:56,Militares sus familiares no hacen cola y pasan hambre ? Hasta cuando se dejan someter por los cubanos? Ayuden a recuperar a Venezuela.,2,6
739571161462378496,2016-06-05 17:34:40,""" @paolucci40 : A PLOMO reprimen protesta del PUEBLO de ORTIZ en GUARICO por HAMBRE #A39MesesDeTuSiembraComandante pic.twitter.com/i7t4xF5j5O """,1,16
738861259404234753,2016-06-03 18:33:46,@hramosallup esos clap terminaran de matar al pueblo de hambre !,1,7
738720024794431488,2016-06-03 09:12:33,#BuenViernes Los CLAPS ahora decidirán que familias tendrán comida y cuáles no en #Caracas . El Gobierno juega con el hambre .,2,22
738431819943706624,2016-06-02 14:07:19,Continúa manifestación en la Avenida FUERZAS Armadas. Hay hambre ... #elpueblotienehambre … https://www. instagram.com/p/BGKVxwFlcqI/,3,13
737479374631514112,2016-05-30 23:02:39,"Grave situación en #Ortiz #Guarico , hay detenidos y heridos de gravedad sólo porque el pueblo estaba pidiendo comida. La gente tiene hambre !",4,57
737458155999887360,2016-05-30 21:38:20,Mientras estas personas gozan con el dinero de la patria otros pasan hambre o mueren por falta de medicinas pic.twitter.com/NcTbVB7KSE,1,24
737348554251997184,2016-05-30 14:22:49,#OEACartaDemocraticaYA Por los miles de millones $ que se han robado y tienen al pueblo pasando hambre ... @Almagro_OEA2015,5,18
735828257472450560,2016-05-26 09:41:42,"Christian Manrique y Oliver Sánchez dos víctimas más de este represivo y criminal gobierno. Maduro= hambre , traición y muerte!",2,9
735195873823621120,2016-05-24 15:48:50,Hasta cuando tendremos que ver noticias de intentos de saqueo como los de Carapita. Ya basta Nicolás el pueblo tiene hambre .,18,70
734926723612020737,2016-05-23 21:59:19,@AnonymissNegra zaqueo en tucuyito edo carabobo saqueo de gandola pueblo grita tienen hambre esto no se detiene,1,6
734926184409096192,2016-05-23 21:57:11,Quién tiene hambre ? pic.twitter.com/SMudsPOFDb,9,10
734796273916760064,2016-05-23 13:20:58,Que descaro el pueblo pasando hambre y Maduro en Trinidad y Tobago #maduroeshambre @maximo_sanchez @JulioBorges pic.twitter.com/aFMAQcgjEM,0,7
733430068261883904,2016-05-19 18:52:09,Los estudiantes de JAVU y otros llevan mas de 300 horas en huelga de hambre enfrente de la @OEA_oficial caracas Apoyalos @Alejatos21,1,7
732679082509533184,2016-05-17 17:08:00,""" @kalt_b : MEGA COLA en Abastos Bicentenario Av Bolívar de Valencia ¡HAY HAMBRE ! pic.twitter.com/oOrhG6poU6 """,0,7
731607566170636288,2016-05-14 18:10:11,"http:// video-lga3-1.xx.fbcdn.net/v/t42.1790-2/1 3219508_220656958320203_1432193115_n.mp4?efg=eyJybHIiOjMwMCwicmxhIjo1MTIsInZlbmNvZGVfdGFnIjoic3ZlX3NkIn0%3D&oh=bf2e8e243b063105c4acfe22aab1a164&oe=5738C2C8 … EN VENEZUELA HAY ESCASEZ, CORRUPCIÓN, INSEGURIDAD, INFLACIÓN, DEVALUACIONES, HOSPITALES SIN INSUMO, HAMBRE",3,9
731260702866980865,2016-05-13 19:11:52,"Lo arrecho es que ahorita como estamos en crisis, no nos llenamos con nada a cada rato nos da hambre .",5,10
730869927171756032,2016-05-12 17:19:04,#ATENCION los Diputados que estaban en HUELGA DE HAMBRE fueron desalojados del TSJ y despojados de sus teléfonos. Ya basta de intimidación.,15,189
730860891764338688,2016-05-12 16:43:09,Mi total apoyo a los diputados @DesiBarboza @yanetfermin @SergioVergaraG que se sumaron a la HUELGA DE HAMBRE pedimos #LibertadYA,11,27
730838069306376192,2016-05-12 15:12:28,"Sigue la HUELGA DE HAMBRE en la Sala Constitucional del TSJ, por los diputados y las oficinas de la Defensoría. #LiberenALosDiputados",5,38
729460584308158465,2016-05-08 19:58:50,"#Urgente Por favor ayudemos a @funasissi sus 200 rescatados están pasando hambre y están muriendo, cualquier colaboración ayuda.",1,18
729056055574016000,2016-05-07 17:11:23,@ThaisOquendo Por qno le dio la Cara esta mañana al Pueblo qse arrecho y protesto en guatire? La Gente y me incluyo tenemos hambre !!,2,8
726426377910640640,2016-04-30 11:01:59,"¿ Hambre o anarquía? Saquean gandola que llevaba bultos de arroz en Tinaquillo http:// bit.ly/1UmCuuk pic.twitter.com/UMiosA4wqZ """,0,10
726361600064544769,2016-04-30 06:44:35,"Murieron de hambre 56 caballos en el Hipódromo de Santa Rita http:// bit.ly/1WwgwW9 pic.twitter.com/1br76JuyKu """,1,7
723709826212216832,2016-04-22 23:07:23,"Vivimos en el distrito 12, con racionamiento de todo y un Capitolio que nos hace jugar los juegos del hambre con el hampa diariamente",2,6
722536720089116672,2016-04-19 17:25:52,@Murachi94 : Ser solidario no es hacer pasar hambre a tu gente y dejarlos morir por falta de medicinas. https:// twitter.com/GenPenaloza/st atus/722414562423611392 …,5,19
722523405736652805,2016-04-19 16:32:58,"Maduro quiere ""gobernar administrando el hambre "", lo que dice @ChuoTorrealba - http:// goo.gl/NLE07Q pic.twitter.com/9Dtx2DESI4 """,9,54
720054410571870208,2016-04-12 21:02:04,"Mientras la competencia de Shows Gobierno vs Oposición sigue. El pueblo sigue pasando hambre y necesidades, sin ver soluciones reales.",3,12
717177090265772032,2016-04-04 22:28:37,"La UCV antes de vestía de Moza, ahora se viste de HAMBRE #UCVAhoraEsNuestroTiempo",4,10
716233253963833345,2016-04-02 07:58:09,""" @jorgemillant : El hambre , la escasez y la inseguridad tienen solución #VzlaExigeRevocatorio pic.twitter.com/4VNg9NI7Vd """,0,7
714516978845802496,2016-03-28 14:18:17,"Qué venezolano puede pagar la canasta básica en 176.974,4 bs? Basta ya de hacer pasar hambre al pueblo. #CambioYA",15,45
710101805926117378,2016-03-16 09:53:58,#FelizMiercoles @NicolasMaduro es un cobarde por no renunciar y dejar que el pueblo pase hambre y trabajo. pic.twitter.com/iFHpqwlzQI,9,16
707320084327505921,2016-03-08 16:40:24,"Sostiene Dip. @FreddyValera_AD ""La miseria y el hambre que padece el pueblo es consecuencia de la corrupción de este gobierno"". #SesiónAN",15,98
706183559057448961,2016-03-05 13:24:15,"@Esteban_reload :Delcy Rodríguez: Comandante Chávez,estamos aquí cumpliendo tu legado.LEGADO: INSEGURIDAD, HAMBRE ,MISERIA, CORRUPCIÓN,ESCASEZ",1,7
701955503048540162,2016-02-22 21:23:28,Vivimos en un mundo donde para acabar con el hambre matamos a los hambrientos... @AntonioM646 pic.twitter.com/iX4iRIjrpz,1,12
701947486190104578,2016-02-22 20:51:36,"El hambre mata más q cualquier otra enfermedad en el mundo,pero no es un mal; Xq de eso no mueren los ricos. pic.twitter.com/UGrpCMnrjV",1,6
701541042995261443,2016-02-21 17:56:33,Bolivia perdiendo el socialismo. Pregunto en Venezuela hasta cuando estaremos con esta peladera y pasadera de hambre,1,6
700125904031346688,2016-02-17 20:13:17,Maduro complace a las mafias y al régimen cubano y declara el hambre para los venezolanos #VenezuelaReaccionaYA #ElTiempoYALlegoVzla,0,10
698558809996980228,2016-02-13 12:26:13,"@y2k06 @GenPenaloza @copipega @NaranjaRA @LucioQuincioC todos a pedir comida a Miraflores, tenemos hambre , no hay medicinas",0,10
695026058098294784,2016-02-03 18:28:19,"Hay mucha hambre y sed, el pueblo muriendo de mengua ...La olla de presión a punto de estallar... @tostonsito1 @Copimil @copipega @querre1",0,9
694511458483343360,2016-02-02 08:23:29,"Cada dia mas cola en Venezuela, El pueblo tiene hambre #VzlaSinComida #cresishumanitaria @Las… https://www. instagram.com/p/BBSRGe_yMz5/",3,13
673473392520118272,2015-12-06 07:05:43,"#LosUcevistasVotamos Por el cambio, por un país distinto al que tenemos, sin hambre , sin persecusión política. pic.twitter.com/Xph4znPjqQ",11,32
670209816925741056,2015-11-27 06:57:26,La historia no podrán ocultarla el 27-NOV. representa la repuesta de los sectores populares ante un país que padecía de hambre represión,8,20
666445482751840258,2015-11-16 21:39:19,"- Mama, tengo hambre + Ahi hay pan y agua - #1DVE pic.twitter.com/nQCkMP5N0R",1,14
660851927564091392,2015-11-01 11:12:32,""" @todoverdadero : #CorruptosEnCampaña >>> Primero nos dividieron, luego nos hipotecaron. pic.twitter.com/nunWNcHNYc ""-Ahora nos matan de hambre !",3,8
653642010528583680,2015-10-12 14:42:54,#DocentesContratoOParoYa . #DocentesContratoOParoYa . #DocentesContratoOParoYa . Docentes con HAMBRE NO PUEDEN ED,1,34
648526773525872640,2015-09-28 11:56:46,"Cumbres van cumbres vienen, siguen las invasiones sigue el hambre sigue la discriminación se violan los acuerdos... pic.twitter.com/GuXQ2zceeX",1,17
643591718055641088,2015-09-14 21:06:37,"El Programa Mundial FAO para erradicar el hambre se llamará ""Hugo Chávez"": éso jamás lo mencionará CNN, ni UNIVISION pic.twitter.com/9fGYRRGz8X",2,19
641034304412381186,2015-09-07 19:44:22,Profesores de las universidades más importantes del país están de paro! Quién forma profesionales con sueldos de hambre ?,1,6
635061252667121664,2015-08-22 08:09:36,En Venezuela la excepción es la que hace el Estado al privar al pueblo de los alimentos y generar hambre,19,167
632678757329932288,2015-08-15 18:22:25,"Amigos. Lo que viene es hambre pareja. "" @ElNacionalWeb : Maduro: Tenemos que prepararnos para una revolución más radical""",61,645
626900016263770112,2015-07-30 19:39:45,@ReneSuareez @JULIOCESARRIVAS en calle el hambre de la trinidad el pepito de pollo vale 660 ... patria,0,8
623742708222398465,2015-07-22 02:33:44,"Por lo tanto nadie puede detener un pueblo, cuando tiene hambre de libertad. ""Simón Bolivar"". pic.twitter.com/LimgOKdpQv",1,6
623197586091020288,2015-07-20 14:27:37,"@valendeviaje estará enterado @NicolasMaduro y todos ellos que dicen que vivimos en la isla de la fantasía y que tenemos patria "" Hambre "".",1,8
616945714283814912,2015-07-03 08:24:55,"Tengo hambre y no me quiero parar de mi cama, ayuda",1,6
612625012193894400,2015-06-21 10:15:59,"Hoy al cumplir 9 dias en huelga d hambre seguimos firmes, exigiendo q se cumpla el petitorio legitimo y democrático pic.twitter.com/X2C4hBCmMi",8,80
611363954355535872,2015-06-17 22:44:59,Ya vamos para nuestro 6to día en huelga de hambre nuestro hermano @leopoldolopez lleva 24dias! #HuelgaXLibertad pic.twitter.com/qhiUu7QrvZ,1,8
611230930284494849,2015-06-17 13:56:24,"Hoy nos trasladamos a la #OEA , como sea haremos cumplir nuestro petitorio, ya son 122hrs en huelga d hambre ! #Vzla pic.twitter.com/AesljCgqkv",0,10
610943096763871233,2015-06-16 18:52:39,Con ya mas de #96Hrs en huelga de hambre seguimos fuertes y convencidos de que lo vamos a lograr! #HuelgaXLibertad pic.twitter.com/3UieauJWdA,0,20
610512582303186944,2015-06-15 14:21:57,A pesar d tener 4Dias en huelga d hambre nuestras autoridades volvieron al #CNE a exigir Fechas ya! #HuelgaXLibertad pic.twitter.com/EReySzdkw5,1,8
610110221835497472,2015-06-14 11:43:06,"Cumplimos #48Hrs en huelga de hambre , mas firmes con nuestras convicciones #HuelgaXLibertad @CeballosLibre #14J pic.twitter.com/EWJzigCWK8",0,13
609413814489116672,2015-06-12 13:35:50,"Gracias al comandante Chávez Venezuela se ha dedicado a erradicar los niveles de hambre , pobreza y desnutrición pic.twitter.com/isIp1uirht",0,15
609031315187494912,2015-06-11 12:15:55,#UltimaHora concejales del Area metropolitana y diputado @jguaido se declaran en huelga de hambre frente al CNE pic.twitter.com/WFvVO7UYVR,1,16
609011329261809664,2015-06-11 10:56:30,#UltimaHora #11J Defensor del Pueblo llega a la huelga de hambre en #IglesiaElLlano #Merida con el SEBIN. ALERTA #HuelgaXLibertad,1,6
608058053154471937,2015-06-08 19:48:31,#UltimaHora desde el SEBIN Nixon leal se suma a la HUELGA DE HAMBRE aquí la carta http:// tl.gd/n_1smj8je #HuelgaXLibertad #SosVzla,1,19
608023009773895680,2015-06-08 17:29:16,#UltimaHora presidente de la FCU-LUZ @YormanBarillas y @rdaltamar y @JoseBarbozaCP inician huelga de hambre ! pic.twitter.com/n18TSglw7r,2,9
607888015499915264,2015-06-08 08:32:51,Venezuela alcanzo y supero la meta del primer Objetivo de Desarrollo del Milenio: Disminuir a la mitad el hambre #VzlaReconocidaXLaFao,0,8
606948182703120385,2015-06-05 18:18:17,"Parece que ""el valiente"" SEBIN no pudo en la Cota 905, porque sus rivales no eran niños en huelga de hambre .",20,181
606811383683010560,2015-06-05 09:14:42,#UltimaHora nuestros concejales @JoseVicenteG y Martín paz (tachira) se unen a la Huelga de hambre desde el VATICANO pic.twitter.com/7mlIXFKOxA,3,20
606290240253390850,2015-06-03 22:43:52,"Por nuestros presos políticos y estudiantes en huelga de hambre , manana iremos al CNE y diremos #TibiPonLaFechaYA . pic.twitter.com/ccGJWwgnyZ",0,15
606217625614417920,2015-06-03 17:55:19,"Se suman a la huelga de hambre en la Iglesia de Chuao El Cafetal Daniel Nizar, Ismael Villamizar y Alejandro Suarez pic.twitter.com/uKd5zykH7l",1,9
605251973831639040,2015-06-01 01:58:10,"#LLiderTeNecesitamosVIVO El pueblo t demostro q contamos y estamos contigo. Suspende la huelga de hambre , tu familia,Vzla t necesita fuerte",18,82
603264981279322112,2015-05-26 14:22:34,#URGENTE se suman a la huelga de hambre desde #Tocuyito @RBADUEL y @elgatodearagua en solidaridad a los presos Politicos ! #26M,0,15
601185736939982848,2015-05-20 20:40:23,"Si no vas a luchar, mejor no tengas sueños... ni hambre ... ni dignidad... ni hijos...” #FreePalestine #Ayotzinapa pic.twitter.com/sP3mfh7IVx",2,7
597210290900590592,2015-05-09 21:23:23,Hoy en la parte más alta de la calle 8 de Los Jardines de El Valle volví a ver la infrapobreza. Gente pasando HAMBRE . Engañada por el PSUV,18,200
595551552439504896,2015-05-05 07:32:09,Salarios de hambre otro logro de la revolución,1,9
591363562980974592,2015-04-23 18:10:35,"“ @EspinozaSara : España sufriendo: hambre , pobreza, suicidios, desempleo, desahucios... pic.twitter.com/TXx2aYX7ud @A3Noticias @ppmadrid",4,22
590517225569804290,2015-04-21 10:07:32,"En esta ""revolución"" el que menos puja, puja un maletín repleto de $$$$$$$$$$$$$$$$$$$ y aún siguen los muertos de hambre creyendo en ellos!",1,6
589561153539469313,2015-04-18 18:48:27,"Durante 2015 trabajadores, Madres Elaboradoras y beneficiarios han recibido Formación para combatir el hambre . pic.twitter.com/z4gBRolbgk",2,18
589034166718697473,2015-04-17 07:54:23,No mas hambre para nuestro pueblos.Se redujo 5% según la FAO. #MaduroEsPazYVictoria y #ElPuebloSalvaAlPueblo,1,21
584804656699809794,2015-04-05 15:47:49,En los sitios turísticos donde los temporadistas vaciaron bodegas y comercios se avecina el hambre pareja.,2,9
582744631563173889,2015-03-30 23:22:01,"Canibalismo avícola: Los pollos en el Tachira enloquecen de hambre y se comen entre ellos. Tremendo legado, chamo.",0,7
580923876881899520,2015-03-25 22:46:59,"Al venezolano sólo le preocupa la escasez, el hambre , el hampa desatada y la inseguridad Sr. @NicolasMaduro deje los trapos rojos",2,11
580559308368318464,2015-03-24 22:38:20,""" @VTVcanal8 : . @NicolasMaduro : Gracias al Comandante Chávez se acabó el hambre en Venezuela"" pic.twitter.com/JzsARz2SvH",1,33
580465739636875264,2015-03-24 16:26:31,"El #COMUNISMO posee un lenguaje que cualquiera puede entender. Sus elementos son hambre , envidia, muerte ! #HeinrichHeine .""",1,12
580414639600742401,2015-03-24 13:03:28,"HAMBRE O CAMPAÑAS DE LA DERECHA | En la subida de Gato Negro, al container de basura lo usaban para comer. Potencia!! pic.twitter.com/D3Q5tV8guU",3,13
574583146575962112,2015-03-08 10:51:12,NO ES BACHAQUEO. NO ES X DESABASTECIMIENTO. NO ES VENEZUELA. ES EN ESPAÑA COLAS X UN PEDAZO DE PAN. PUEBLO CON HAMBRE pic.twitter.com/NVF3XhND3b,1,10
572594473395462144,2015-03-02 22:08:55,El que demuestra hambre no come,0,6
571505421267181568,2015-02-27 22:01:25,"@zurdakonducta02 la diferencia d hace 26 años atrás a hoy en día, era q ants nos stábamos muriendo d hambre y hoy es un capricho d un grupo",0,9
571330222395695104,2015-02-27 10:25:14,"El Caracazo, fue la chispa que encendió la conciencia de un Pueblo cansado por el hambre y la masacre de su gente! pic.twitter.com/qhEG2VQ6CX",1,9
571299420395978752,2015-02-27 08:22:50,"Nos alzamos contra la corrupción, el hambre el desempleo la desidia la discriminación, EL DESPERTAR DE LA HISTORIA",5,11
571138309214343168,2015-02-26 21:42:38,""" @_RoqueCastro : Chávez destruyó un país que pudo ser la envidia del mundo... lo sumió en HAMBRE MISERIA Y MUERTE... fue la peor plaga",1,19
570600404628709378,2015-02-25 10:05:12,. @mercalyaracuy : matutino en Abasto Supermercal San Felipe sobre el plan nacional con la FAO para erradicar el hambre pic.twitter.com/H6GQtd9eAB,0,22
569566746602029056,2015-02-22 13:37:49,AQUI ESTA TODAVIA EL PRIMER ESCUALIDO BALSERO Q SALE DE VENEZUELA POR HAMBRE . DICE Q NO CONSIGUE JABON EN POLVO. pic.twitter.com/XxXCk0Inlm,8,68
569475444375994368,2015-02-22 07:35:00,SEÑORES EL PRIMER ESCUALIDO BALSERO Q SE ESCAPA DEL HAMBRE Q HAY EN VENEZUELA pic.twitter.com/BoawBRwTbt,4,21
569060712003325952,2015-02-21 04:07:01,"Al igual q @alcaldeledezma logró doblegar a Chávez con la huelga de hambre en la OEA, con más razón doblegara a Maduro x injusto secuestro",6,57
567523290231869440,2015-02-16 22:17:51,""" @Globoterror : Ante la falta de comida, miles de venezolanos se echan al sol para morir de hambre e insolación pic.twitter.com/zQq8skjS4h """,0,8
564546034018582528,2015-02-08 17:07:17,""" @TAMARA_SUJU : Jóvenes en huelga de hambre en SEBIN necesitan Pedialite. Por favor contacten a sus padres.""",2,17
564248409193070592,2015-02-07 21:24:38,"En la tumda se declaran en huelga de hambre ."" pic.twitter.com/AcCSCbWYDK",1,13
563757106281869312,2015-02-06 12:52:22,Q TRISTE Q MUCHOS Y MUCHAS ARTISTAS DE TV. Q PRESTARON SU IMAGEN PARA LAS GUARIMBAS ESTAN PASANDO HAMBRE EN MIAMI pic.twitter.com/tkCLk6WfC7,0,10
563508742915129344,2015-02-05 20:25:28,#SOSVzla este gobierno nos está matando de hambre y en las calles mueren cientos de personas a diario en manos de delincuentes. #impunidad,4,54
562944359394717699,2015-02-04 07:02:48,"Los HT de hoy #4F #NoALosGolpistas 23 años escribiendo una historia de muerte, corrupción, militarismo, hambre , odio, abusos",0,8
562074789272379392,2015-02-01 21:27:27,#MercalYPdvalSonDelPueblo y gracias a Chavez y @NicolasMaduro somos un país con Hambre Cero! #YoLeVoyALaPaz @czosorio pic.twitter.com/6WzJvNARgr,10,56
561765817046810625,2015-02-01 00:59:42,"@HenryHachepe @BELLAYROJ @patriciajaniot sabes cuantos colombianos se benefician en Venezuela? Porque en tu pais los matan de hambre ,miseria",1,6
561674072351080448,2015-01-31 18:55:08,@UltimaHoraSV @copipega @Copimil El pueblo se muere de hambre . Y Naduro montado en un avion paseando en el mundo entero. Que Bolas,1,23
561161437419421697,2015-01-30 08:58:07,"Eramos pocos y pario la abuela, a las colas d hambre se unen las d la d las bombas d esto s n Merida. Gasolina no hay pic.twitter.com/uMr8eGNrm6",3,42
560967507918749697,2015-01-29 20:07:30,¡LO QUE HAY ES HAMBRE ! Saquearon gandola volcada en la bajada de Tazón: Tendría láct http:// bit.ly/1zaEw6l pic.twitter.com/mLvY7uNnEL,1,12
559710638084456448,2015-01-26 08:53:09,"LOS JUEGOS DEL HAMBRE . Este es el país que Maduro llama la Gran potencia Latinoamericana? . pic.twitter.com/2Po1nNZiCk @copipega """,1,16
559470571835387904,2015-01-25 16:59:13,"Mas humillados imposible, esto s hambre , necesidad o costumbre? esta cuerda d viejos matarían x un pollo? Mega Mercal pic.twitter.com/uPxQOxrb5i",2,7
559352499338215424,2015-01-25 09:10:02,"CUANDO EL MUNDO VE ESTAS IMAGENES SE PREGUNTAN,DE Q HAMBRE HABLAN ELLOS?OBSERVEN A LA GORDA Y TODOS ESOS DESNUTRIDOS pic.twitter.com/mwGlQLb51g",0,8
559166158449164288,2015-01-24 20:49:35,""" @conchienchia : Fascistas con hambre ? . @ForoCandanga pic.twitter.com/D2KiHbDDqR "" Las chicas Belmont ... Bel Mondongueroo",0,16
559158278480228352,2015-01-24 20:18:16,"MEXICO Y ARGENTINA,OBSERVEN ESTOS GORDOS OPOSITORES MARCHAN PORQUE SEGUN PASAN HAMBRE ahora observen la foto africa pic.twitter.com/AS4UXAGUnA",1,8
559112432900382720,2015-01-24 17:16:06,"Una cuerda de gorditas protestando por el hambre en vzla.?????? #MarchaDeLasCallesVACIAS y de la #EscasezDeIDEAS pic.twitter.com/RD4n62cg0Q """,3,39
559067329230012416,2015-01-24 14:16:52,""" @jogre8a : JEJE ESTE GORDO DENUNCIA QUE MADURO TIENE PASANDO HAMBRE #MarchaDeLasOllasVacias VENEZUELA pic.twitter.com/qkfXKegRt4 """,2,6
558948863000989696,2015-01-24 06:26:08,@RoiLopezRivas LOS GUARIMBEROS MARCHAN HOY CONTRA EL ACAPARAMIENTO Y EL HAMBRE QUE LOS TIENE PASANDO LA MACHADO pic.twitter.com/uWFsTkwjBN,1,7
558646124685578240,2015-01-23 10:23:09,Y un día el hambre vino y los sapos seguían gordos...,3,18
556666579522715649,2015-01-17 23:17:09,A UNOS LES OBLIGAN A IR Y A OTROS A PASAR HAMBRE ! @GuaroTerepaima : pic.twitter.com/l54Pq0gKyP .. @LucioQuincioC @antenax2 @copipega @globovision,2,32
555527770957418496,2015-01-14 19:51:56,"Presa por tuitear, preso por fotografiar, presa por protestar, solo faltan presos por pensar y tener hambre pic.twitter.com/LEoADzuOjX",4,34
555488493405999104,2015-01-14 17:15:51,"¡El PAÍS SE MATA POR COMIDA Y?? Elías Jaua: “Aquí no había producción, hoy Venezuela es país sin hambre ” http:// bit.ly/14B61cm",1,8
554773221741166592,2015-01-12 17:53:37,""" @iElFilosofo : Gente pobre con uniforme, golpeando a gente pobre con hambre , para beneficiar a gente rica sin uniforme y sin hambre",0,7
554583621475266560,2015-01-12 05:20:13,"Mientras El Régimen habla de Guerra Económica #AnaquelesVaciosEnVenezuela generan hambre y humillación pic.twitter.com/5YJQXaAFfK """,1,6
553951955002077185,2015-01-10 11:30:12,"El pueblo pasando hambre y la familia de @NicolasMaduro así: "" @VVperiodistas : Material para repartir en las colas pic.twitter.com/lIOgNlEYSU",0,12
553940845922357248,2015-01-10 10:46:04,"""El hambre no aguanta ideologías, tantos muertos o revoluciones fracasadas. #Venezuela "" @andresvolpe",2,63
553414104292274177,2015-01-08 23:52:59,"#TROPA MIRA El VILLEGAS MIENTRAS A QUI NOS MORIMOS DE HAMBRE SU HIJITO EN EL IMPERIO ESTUDIANDO pic.twitter.com/SvJpJVMuuF """,2,33
553159106476113920,2015-01-08 06:59:42,"Esto es revolución hambre y Palazón, en el bicentenario de Guarenas pic.twitter.com/mmrOriML8O",0,29
552602261432827905,2015-01-06 18:07:00,ya bajaron los cerros pacíficamente! Hasta cuándo estarán así? Tienen hambre,0,9
551800538434519040,2015-01-04 13:01:14,Con @NicolasMaduro en el #2015PuebloVictorioso vamos rumbo al hambre 0 #PorUnaVenezuelaProductiva @YvanJoseBello pic.twitter.com/Bg3BI4G5EV,2,25
551576765685321730,2015-01-03 22:12:03,"@RC_Caracas @TURADIONET2 NO HAY pollo ni carne ni nada. Tenemos que esperar pasar hambre ? #CalleYA pic.twitter.com/dKEm9drlzj """,2,37
547841635665858561,2014-12-24 14:49:59,Así están los basureros del sambil.... no les cabe una bandeja mas.... y el pueblo se muere de Hambre ... pic.twitter.com/9QIg17Elny,0,8
542850134493908992,2014-12-10 20:15:32,LOS ANCIANOS DE VENEZUELA ESTAN MURIENDO DE HAMBRE Y ENFERMEDADES PORQUE PENSION NO ALCANZA #pensionados #jubilados,0,9
